{
  "case_id": "NYDEV-006",
  "actual_outcome": "upheld",
  "reviewer_rationale": "The reviewer found Vyepti not medically necessary because there is no direct comparative evidence showing Vyepti would outperform a trial of the plan's preferred self-administered CGRP agent (Ajovy), the patient's self-reported needle aversion does not itself rule out third-party or clinical administration of an injectable, and the plan's offered alternative is well supported by the literature for this condition.",
  "decisive_facts": [
    "No direct head-to-head comparison data exists showing Vyepti's superiority over Ajovy.",
    "No documented trial of Ajovy specifically, despite trials of related CGRP agents Aimovig and Emgality.",
    "Needle aversion alone was not considered a sufficient contraindication to a self-administered alternative."
  ],
  "missing_or_weak_evidence": [
    "No documented trial of Ajovy specifically."
  ],
  "cited_authorities": [
    "Lipton RB, et al. Efficacy and safety of eptinezumab in patients with chronic migraine: PROMISE-2. Neurology 94.13 (2020): e1365-e1377.",
    "Dodick DW, et al. Eptinezumab for prevention of chronic migraine: randomized phase 2b trial. Cephalalgia 39.9 (2019): 1075-1085.",
    "Burch R. Preventive migraine treatment. Continuum: Lifelong Learning in Neurology 27.3 (2021): 613-632."
  ],
  "outcome_revealing_phrases_removed": [
    "The denial is upheld.",
    "The health plan's determination of medical necessity is upheld in whole.",
    "is not medically necessary for this patient"
  ],
  "source_hash": "a647846552bb523d81e1ddaca45281f1a68caefa89c72e52ef24223ba66c7a29",
  "preparer": "Sophia Stolte - field-by-field verification against the source snapshot completed",
  "reviewer": "pending_second_pass_leakage_review",
  "approval_status": "pending_founder_review",
  "founder_reviewed": false
}
