{
  "case_id": "NYDEV-005",
  "actual_outcome": "overturned",
  "reviewer_rationale": "The reviewer found Nurtec ODT medically necessary because the patient had tried and failed multiple triptans (ineffective or intolerable), and per FDA-approved labeling and clinical trial literature, Nurtec ODT (a Gepant) is an appropriate alternative therapy for acute migraine when triptans are ineffective or not tolerated.",
  "decisive_facts": [
    "Reported trial and failure of three triptans (Sumatriptan, Zolmitriptan, Rizatriptan) due to inefficacy or intolerable side effects.",
    "Nurtec ODT's FDA approval and trial data support use as an alternative to triptans for acute migraine."
  ],
  "missing_or_weak_evidence": [
    "Contemporaneous outpatient documentation of the triptan trial/failure was not present in the original submission (only the provider's appeal-stage report)."
  ],
  "cited_authorities": [
    "Lipton RB, et al. Rimegepant, An Oral CGRP Receptor Antagonist, For Migraine. NEJM 381.2 (2019): 142-149.",
    "Croop R, et al. Efficacy, Safety, and Tolerability of Rimegepant ODT for Acute Treatment of Migraine. The Lancet 394.10200 (2019): 737-745.",
    "Yang CP, et al. Comparison of New Pharmacologic Agents with Triptans for Treatment of Migraine: Systematic Review and Meta-analysis. JAMA Network Open 4.10 (2021): e2128544."
  ],
  "outcome_revealing_phrases_removed": [
    "The health plan's determination is overturned.",
    "The health plan's determination of medical necessity is overturned, in whole.",
    "Nurtec ODT is medically necessary."
  ],
  "source_hash": "92d80baa8a0b4cb7bd56baf5fc83bcd4bc4e404baeb9173cdb65828e152e6511",
  "preparer": "Sophia Stolte - field-by-field verification against the source snapshot completed",
  "reviewer": "pending_second_pass_leakage_review",
  "approval_status": "pending_founder_review",
  "founder_reviewed": false
}
